card,topic,summary
Eight of Pentacles,general,"The Eight of Pentacles card signifies a period of dedicated effort and skill development, emphasizing perseverance and balance in personal and professional tasks. It assures that hard work will lead to future success, wisdom, and self-confidence. Additionally, it highlights the importance of continuous personal growth and attention to detail to enhance life circumstances and achieve mastery."
Eight of Swords,general,"The Eight of Swords generally signifies a state of feeling trapped and powerless, often due to one's own negative mindset and fears. It highlights the importance of recognizing self-imposed limitations and encourages individuals to shift their perspective, reclaim personal power, and overcome mental barriers. Additionally, the card warns against surrendering control to external forces and advises caution in decision-making, as it alludes to potential judgment and consequences."
Eight of Wands,general,"The Eight of Wands represents the end of past challenges, ushering in a period of rapid progress and positive momentum across various life areas. It stresses the importance of patience and readiness for imminent opportunities and significant news, encouraging the use of newfound energy to achieve personal and professional goals. This card highlights the swift advancement towards success, suggesting that sustained efforts will soon result in positive developments."
Emperor,general,"The Emperor card consistently symbolizes authority, leadership, and a paternal influence, emphasizing strategic planning and discipline. It suggests a leadership role where logic, structure, and responsibility are essential for achieving success, ensuring stability and security. This card highlights the balance between ruling and serving for the greater good, both in personal and professional contexts."
Empress,general,"The Empress card universally embodies femininity, creativity, and nurturing, encouraging all individuals to embrace these qualities. It signifies pregnancy, new beginnings, and the success of personal endeavors, while emphasizing the importance of self-care, nurturing relationships, and connecting with nature. The card highlights a period of abundance and fulfillment, urging gratitude for life's rewards and blessings."
Five of Cups,general,"The Five of Cups symbolizes disappointment and emotional turmoil arising from unmet expectations and past experiences, leading to feelings of regret, loss, and isolation. It warns against dwelling on negativity while emphasizing the importance of recognizing potential positivity and new opportunities, as symbolized by the remaining upright cups. Despite its negative aspects, the card carries a hopeful message, encouraging a shift in focus towards future possibilities and hope amid adversity."
Five of Pentacles,general,"The Five of Pentacles signifies a period of hardship and insecurity, often involving financial loss, illness, or emotional rejection. It highlights feelings of loneliness and isolation but reassures that these challenges are temporary. The card advises seeking help and shifting focus from scarcity to gratitude, as assistance is available and the situation will improve."
Five of Swords,general,"The Five of Swords card symbolizes conflict, tension, and negative ambition, warning against prioritizing ego and self-destructive behaviors over relationships. It highlights the dangers of poor communication and deception, which can lead to isolation or hostility, and urges individuals to approach conflicts with understanding and compassion. Despite the potential for a hard-won victory, the card emphasizes the importance of fostering healthier relationships and personal growth by setting aside egotistical pursuits."
Five of Wands,general,"The Five of Wands symbolizes conflict and competition, often driven by poor communication and clashing egos. It underscores the importance of fostering open dialogue and understanding to resolve disputes and advises a constructive approach to competition and personal struggles. The card emphasizes confronting and solving underlying issues to promote growth and harmony."
Fool,general,"The Fool card, a symbol of new beginnings and infinite potential, inspires embarking on life's adventures with optimism and curiosity. While it promises growth and success, it advises balancing enthusiasm with thoughtful decision-making to effectively navigate and embrace new opportunities."
Four of Cups,general,"The Four of Cups represents a phase of stagnation and disillusionment, characterized by feelings of apathy and regret. It urges self-reflection and a shift in perspective to overcome mental barriers and recognize opportunities that can lead to renewed passion and positive developments. The card warns against focusing solely on negativity and emphasizes the importance of remaining open to potential offers and carefully evaluating available choices."
Four of Pentacles,general,"The Four of Pentacles emphasizes the importance of financial stability and responsible management, while warning against the dangers of possessiveness, greed, and a scarcity mindset. It highlights the need to balance wealth accumulation with openness to life's pleasures, maintaining healthy relationships, and setting boundaries. The card cautions against allowing materialism and the desire for control to lead to isolation and hinder personal growth."
Four of Swords,general,"The Four of Swords indicates a period of rest and reflection, emphasizing the need to step back from chaos to heal and regain mental clarity. It advises managing stress through introspection and rational planning, often in a peaceful setting, to reassess priorities. This card encourages individuals to rejuvenate and prepare themselves for future challenges."
Four of Wands,general,"The Four of Wands symbolizes a time of celebration, stability, and happiness, emphasizing the joy of connecting with loved ones. It highlights the importance of family gatherings and reunions, marking personal and communal achievements. This card reflects harmonious dynamics and successful outcomes in both personal and professional realms."
Hanged Man,general,"The Hanged Man card highlights the importance of pausing and sacrificing immediate actions to gain a new perspective and progress. It suggests that feelings of being stuck or dissatisfied can be addressed by changing perspectives, releasing control, and allowing time for reflection. Embracing this pause, whether intentional or imposed, opens the path to clarity and new opportunities, guided by intuition."
Hermit,general,"The Hermit card signifies a period of introspection and spiritual enlightenment, emphasizing the necessity of solitude to connect with one's inner self and align with personal values. It suggests withdrawing from social interactions to focus on self-care, healing, and self-discovery, often with guidance from mentors or professionals. This phase is about finding inner truth and wisdom, free from external distractions."
Hierophant,general,"The Hierophant card symbolizes a strong alignment with traditional norms, established systems, and institutional values. It emphasizes conformity to societal rules and participation in rituals or ceremonies, often under the guidance of mentors or spiritual advisors. At the same time, it encourages individuals to explore their personal beliefs and values, finding balance between tradition and individuality. This card invites introspection and alignment with one’s inner truth, suggesting that wisdom and growth can come from both external guidance and internal self-reflection."
High Priestess,general,"The High Priestess card highlights the importance of intuition, inner knowledge, and spirituality. It advises trusting one's instincts and listening to the inner voice, symbolizing the divine feminine. This card also represents a time for reflection, self-discovery, and uncovering hidden truths. It encourages spiritual growth and suggests that answers and personal clarity can be found by looking within, balancing logic with emotional depth to achieve greater understanding and enlightenment."
Judgement,general,"The Judgement card signifies a pivotal period of self-reflection and spiritual growth, urging individuals to learn from past experiences and make transformative, life-changing decisions. It emphasizes the importance of releasing past regrets, embracing one's true purpose, and being prepared for new challenges and opportunities. Additionally, the card addresses themes of judgment, legal matters, and reunions with loved ones."
Justice,general,"The Justice card consistently emphasizes accountability, fairness, and the inevitable consequences of actions. It highlights the critical importance of truth and integrity in decision-making, urging individuals to carefully weigh their options in both personal and legal matters. The card signals that outcomes are final and necessitates acceptance and adaptation to these results."
King of Cups,general,"The King of Cups symbolizes a harmonious balance between intellect and emotions, emphasizing emotional maturity, wisdom, and self-awareness. This card advocates for maintaining composure and a diplomatic demeanor in challenging situations, highlighting the importance of understanding and controlling emotions. It represents a wise and empathetic figure who provides guidance and support, encouraging the use of intuition and rational thought to navigate relationships and life's challenges effectively."
King of Pentacles,general,"The King of Pentacles embodies success and prosperity achieved through hard work, responsibility, and wise management of resources. He serves as a stable and supportive figure in both career and personal life, offering security and constructive criticism. Financially conservative, he underscores the importance of achieving goals and preparing for a prosperous future, often linked with Earth signs."
King of Swords,general,"The King of Swords embodies objectivity, intellect, and authority, emphasizing logic over emotion in decision-making. It is associated with ethical standards and structured environments, often linked to legal or authoritative roles. While representing a disciplined and protective figure, the card cautions against becoming cold or tyrannical when faced with irrationality."
King of Wands,general,"The King of Wands symbolizes a confident and energetic leader who is focused on achieving goals and solving challenges. He inspires others with his charisma and vision, valuing independence and ethical leadership while remaining decisive and persistent in his pursuits. Through his dynamic approach, he guides others towards shared objectives, maintaining a balance between self-assurance and ethical responsibility."
Knight of Cups,general,"The Knight of Cups embodies emotion, intuition, and charm, bringing exciting opportunities and news that encourage heartfelt and creative pursuits. He is compassionate and idealistic, thriving on beauty and romance, and inspires decisions driven by feelings. Known for his warmth, he supports exploring passions and turning dreams into reality."
Knight of Pentacles,general,"The Knight of Pentacles represents dedication, reliability, and perseverance in achieving goals through hard work and systematic effort. It emphasizes the importance of being practical and responsible, maintaining a routine, and sticking to proven methods for success. The card also highlights a stable and protective nature, though it may come with challenges in emotional expression due to a conservative upbringing."
Knight of Swords,general,"The Knight of Swords is a card of significant change, urging readiness and swift action. It symbolizes assertiveness, intelligence, and boldness, often linked to leadership and risk-taking, while cautioning against impulsiveness. The card emphasizes the necessity of balancing ambition with responsibility, foresight, and compassion."
Knight of Wands,general,"The Knight of Wands symbolizes energy, enthusiasm, and a readiness for adventure and change, urging individuals to pursue their goals with confidence and vigor. It highlights the potential for significant transformations and emphasizes the importance of balancing impulsiveness with careful planning, while being open to unexpected events and challenges. Representing both personal traits of courage and situational dynamics, the card stresses the thrill of new ventures and the readiness to face challenges."
Lovers,general,"The Lovers card consistently represents harmony, unity, and trust within relationships, highlighting the significance of deep connections and strong bonds. It emphasizes the need for making informed and meaningful choices, fostering personal growth through self-discovery and the establishment of individual values. The card encourages authenticity and the courage to transcend societal expectations, promoting genuine self-expression."
Magician,general,"The Magician card embodies the idea of utilizing your inner power and skills to manifest your desires and create positive change. It emphasizes the importance of taking decisive action and aligning with the universe to achieve success and transformation. By focusing your intellect and willpower, you can seize opportunities and reach your full potential."
Moon,general,"The Moon card symbolizes illusions and fears, urging the use of intuition to uncover hidden truths and address repressed emotions. It warns against anxiety, potential deceit, and unclear decisions, advising caution. The card emphasizes connecting with the subconscious for deeper understanding and wisdom."
Nine of Cups,general,"The Nine of Cups symbolizes the fulfillment of desires and dreams, ushering in a period of extreme happiness and self-satisfaction. This card signifies a transition from challenging times to joy and achievement, positively influencing work, love, finances, and health. It also highlights confidence, success, and recognition, indicating opportunities for celebration and personal growth."
Nine of Pentacles,general,"The Nine of Pentacles represents a stage of confidence, independence, and material success achieved through hard work and self-discipline. It highlights the importance of enjoying the rewards of one's efforts, such as luxury and comfort, while recognizing the spiritual growth gained from past challenges. Additionally, the card stresses the need for self-reliance, sharing success with others, and maintaining a balance between personal and professional life."
Nine of Swords,general,"The Nine of Swords card symbolizes deep fear and anxiety, which can lead to stress, mental anguish, and feelings of being overwhelmed. These emotions often magnify perceived problems, causing isolation and regret. Relief may be found through sharing burdens and concentrating on aspects within one's control."
Nine of Wands,general,"The Nine of Wands depicts resilience and determination during challenging times, urging courage and perseverance to overcome obstacles. It acknowledges past struggles and advises trusting the process, as success is near despite feelings of exhaustion. The card suggests that a change in perspective can bring hope, and inner strength is sufficient to face adversities."
Page of Cups,general,"The Page of Cups encourages embracing creativity, intuition, and emotional openness, which leads to personal growth and unexpected joy or happiness."
Page of Pentacles,general,"The Page of Pentacles represents ambition, practicality, and the importance of establishing solid foundations for achieving success in material and earthly matters. It encourages a diligent and pragmatic approach, emphasizing the need for decisive action and careful planning to realize personal goals and long-term achievements. This card is associated with new beginnings, creativity, and a grounded mindset, symbolizing the potential for growth and prosperity in practical pursuits."
Page of Swords,general,"The Page of Swords embodies a lively, intelligent individual with a strong curiosity and passion for communication and ideas. It signifies delayed news, urging patience, vigilance, and careful communication, while highlighting mental agility and a commitment to justice. Often linked to air signs, this card encourages exploring new concepts, despite the potential for bluntness or gossip."
Page of Wands,general,"The Page of Wands symbolizes youthful energy, excitement, and creativity, urging the exploration of new opportunities and the pursuit of dreams. It emphasizes the importance of courage and determination but cautions against impulsiveness and distractions. To achieve success, the card advises careful planning and strategic thinking before taking action."
Queen of Cups,general,"The Queen of Cups is a nurturing, compassionate figure, often a woman, who connects deeply with others on an emotional level through intuition and empathy. She encourages self-love and emotional health, using her powerful intuition to guide and support others while maintaining personal boundaries. This card highlights the importance of emotional insight, creativity, and the use of intuition over logic in understanding and assisting others."
Queen of Pentacles,general,"The Queen of Pentacles embodies a nurturing and practical figure who balances family responsibilities with business success and financial independence. She is a symbol of high social status and prosperity, advocating for a sensible, goal-oriented approach to life. Her nurturing nature ensures a secure and supportive environment, harmonizing personal and professional commitments."
Queen of Swords,general,"The Queen of Swords embodies a wise and protective feminine figure who values intellect, truth, and realism. She offers support and candid advice, emphasizing independence and direct communication while expecting honesty from others. The card also suggests the importance of addressing unresolved past emotional issues."
Queen of Wands,general,"The Queen of Wands represents a dynamic and courageous individual characterized by intense passion, creativity, and determination. She inspires those around her with her optimism and ability to connect socially, achieving significant success in career and love while maintaining balance to avoid chaos. Though she must be cautious with finances, her supportive and energetic nature drives her toward her goals."
Seven of Cups,general,"The Seven of Cups card signifies the presence of numerous options, which can be overwhelming and lead to wishful thinking. It emphasizes the need to distinguish between reality and illusion, advocating for careful evaluation of choices and realistic decision-making. The card advises focusing on one achievable goal and taking practical actions, cautioning against over-commitment and living in a dream world."
Seven of Pentacles,general,"The Seven of Pentacles highlights the importance of investment, effort, and strategic planning for long-term success. It acknowledges that while hard work may yield slow progress and potential frustrations, perseverance, patience, and gratitude are essential for achieving meaningful goals. The card encourages reflection and wise energy allocation to ensure eventual rewards and accomplishments."
Seven of Swords,general,"The Seven of Swords embodies themes of deception, betrayal, and strategic cunning, often highlighting situations where individuals attempt to escape detection after engaging in dishonest or underhanded actions. It represents mental manipulation, risk-taking, and the use of clever tactics to gain an advantage. At the same time, it encourages careful planning and the ethical use of intellect and resourcefulness to navigate challenges. This card warns against dishonesty and enemies disguised as friends, while reminding individuals to stay true to their values to avoid negative consequences and maintain integrity."
Seven of Wands,general,"The Seven of Wands symbolizes the struggle to maintain success amid challenges and opposition. It emphasizes the necessity of defending your achievements and standing firm in your beliefs with resilience and determination. This card warns of potential adversaries and pressures, highlighting the importance of self-belief and perseverance to overcome setbacks and protect your position."
Six of Cups,general,"The Six of Cups is a Tarot card that embodies nostalgia, childhood memories, and connections to the past, urging individuals to revisit meaningful relationships and places for comfort and support during challenging times. It emphasizes themes of innocence, simplicity, and the importance of family bonds, while cautioning against excessive focus on the past or immaturity. The card also highlights the presence of children and the significance of familial support."
Six of Pentacles,general,"The Six of Pentacles represents balance, generosity, and the exchange of giving and receiving. It encourages sharing wealth and support, fostering community spirit and gratitude, while being open to receiving help. The card highlights the spiritual rewards of generosity, advising caution against dependency and promoting self-sufficiency."
Six of Swords,general,"The Six of Swords symbolizes a necessary yet challenging transition, often prompted by past decisions, requiring the release of attachments for future happiness. It highlights the journey towards stability and relief after hardships, emphasizing the importance of logical planning, clarity, and intuition in navigating these changes. Despite the inherent sadness, this card underscores the significance of moving forward to achieve growth and success."
Six of Wands,general,"The Six of Wands card represents success, victory, and public recognition for achieving goals and overcoming past challenges. It highlights the potential for fame and acknowledgment, but also warns against arrogance, urging the importance of humility despite accomplishments."
Star,general,"The Star card embodies themes of hope, renewal, and spiritual growth following adversity. It signifies a transition from chaos to tranquility, highlighting inner strength, resilience, and a deeper connection with the universe. This card encourages embracing change, healing, and pursuing personal dreams with optimism."
Strength,general,"The Strength card in Tarot symbolizes inner strength, courage, and patience, guiding individuals to overcome challenges by mastering emotions and using compassion and tact. It highlights the importance of resilience, dignity, and gentle persuasion instead of force, assuring that stability and success are attainable through these qualities. By tapping into one's inner strength and fearlessness, one can achieve confidence and control in life."
Sun,general,"The Sun card represents success, joy, and positive energy, signifying a period of personal fulfillment and confidence. It highlights the resolution of challenges and the revelation of truth while encouraging the sharing of love and achievements with others. The card underscores the importance of expressing one's true self and connecting with inner power."
Temperance,general,"The Temperance card embodies the themes of balance, harmony, and moderation, advocating for composure and patience during stressful times. It emphasizes the importance of inner calm, self-awareness, and harmonious relationships while advising against extremes. The card highlights fostering cooperation and maintaining a clear vision with a measured approach to achieving long-term goals."
Ten of Cups,general,"The Ten of Cups signifies ultimate happiness, emotional fulfillment, and harmony in relationships, whether familial or romantic. It embodies a 'happily ever after' state marked by contentment, abundance, and a strong sense of community. This card encourages embracing one's instincts to pursue genuine connections and fulfilling opportunities."
Ten of Pentacles,general,"The Ten of Pentacles signifies the culmination of long-term efforts resulting in financial prosperity, security, and strong family ties. It underscores the importance of making wise decisions that benefit both the present and future generations, ensuring a stable and harmonious life. This card highlights the fulfillment derived from achieving material goals and maintaining familial happiness."
Ten of Swords,general,"The Ten of Swords symbolizes disaster, betrayal, and the ultimate end of relationships or situations, often accompanied by exhaustion and a sense of hitting rock bottom. Despite its negative implications, the card warns against adopting a victim mentality and highlights the inevitability of certain forces in life. Importantly, it encourages letting go of past losses to embrace new beginnings and personal growth."
Ten of Wands,general,"The Ten of Wands indicates that success, while rewarding, often brings new challenges and responsibilities that can become burdensome if not managed properly. It emphasizes the need for careful prioritization and time management to avoid feeling overwhelmed and stressed. Collectively, the interpretations suggest balancing the pursuit of success with effective responsibility management to prevent exhaustion and achieve sustainable progress."
Three of Cups,general,"The Three of Cups represents a period of joy, celebration, and meaningful reunions with loved ones, emphasizing positive energy and support from a close-knit circle. It signifies the end of social challenges, allowing for reconnections with long-lost friends or family and anticipating joyful events such as weddings or parties. This card highlights the importance of spending quality time with those who provide love and support, bringing uplifting experiences and good feelings."
