card,topic,summary
Nine of Wands,finance,"The Nine of Wands consistently emphasizes financial pressure and advises against using savings or taking loans. Instead, it encourages seeking additional income sources and leveraging resilience and past experiences to navigate the situation. With determination, this temporary financial challenge can be successfully overcome."
Page of Cups,finance,"The Page of Cups in finance underscores the importance of balancing creativity and intuition with practicality and caution. It encourages exploring new financial opportunities and trusting one's instincts while warning against unrealistic goals and risky investments. A focus on achievable objectives, thorough research, and informed decision-making is essential for long-term financial success."
Page of Pentacles,finance,"The Page of Pentacles forecasts positive financial developments, emphasizing the necessity of planning, research, and budget management. It encourages exploring new opportunities, learning new skills, and taking practical steps to achieve financial success, with the promise of significant material improvements."
Page of Swords,finance,"The Page of Swords in finance emphasizes the value of curiosity and emerging ideas. It underlines the importance of seeking advice from experienced individuals and exploring financial products to make informed decisions. While maintaining an open mind and avoiding overconfidence is crucial, it is also important to anticipate potential delays in financial developments."
Page of Wands,finance,"The Page of Wands indicates unexpected financial gains, such as gifts or bonuses, and advises saving a portion to prepare for potential financial challenges ahead. It emphasizes the importance of balancing enjoying the windfall with prudent saving, while also encouraging an enthusiastic and open approach to new financial opportunities. Caution is advised against impulsive spending to ensure long-term financial stability."
Queen of Cups,finance,"The Queen of Cups in finance underscores the importance of using financial resources to support others with compassion and empathy. It advises that money should not overshadow other life priorities and emphasizes the significance of trusting intuition and emotional intelligence in financial decisions. While indicating potential financial security, it cautions against engaging in complex financial strategies, urging a focus on other meaningful aspects of life."
Queen of Pentacles,finance,"The Queen of Pentacles signifies financial abundance and security achieved through diligent effort and responsible management. It highlights the importance of balancing enjoyment with practicality and frugality, ensuring quality without extravagance. Additionally, the card encourages gratitude and alignment with financial goals, potentially receiving support from a strategic partner."
Queen of Swords,finance,"The Queen of Swords in finance emphasizes using logic and wisdom, maintaining a balance between emotion and reason. It advocates for independence, clear communication, and setting boundaries when assisting others, while valuing sound advice and attention to detail. Trust in your intellect and resilience to successfully navigate financial matters."
Queen of Wands,finance,"The Queen of Wands in finance symbolizes a phase of confidence and strategic decision-making, where you are well-equipped to make informed financial choices. Careful planning and strong instincts empower you to expand your financial ventures, leading by example and fostering prosperity. Trust your intuition and remain focused to capitalize on this opportune time for financial growth and leadership."
Seven of Cups,finance,"The Seven of Cups in finance highlights numerous opportunities but warns of potential confusion and illusions. It emphasizes the need for proactive decision-making, clear goal setting, and critical evaluation of financial options to avoid unrealistic expectations. Monitoring and reassessing spending habits are essential to ensure long-term financial stability and success."
Seven of Pentacles,finance,"The Seven of Pentacles underscores the significance of patience, perseverance, and steady effort in financial pursuits. It reveals that investments and projects are beginning to yield results, with rewards and bonuses expected soon. This card encourages trusting the growth process, reflecting on past successes, and strategically planning for future financial achievements."
Seven of Swords,finance,"The Seven of Swords consistently warns of financial deceit, scams, and unethical behavior, urging caution and vigilance in financial dealings. It advises against engaging in risky ventures or deals that appear too good to be true and highlights the necessity of maintaining secure financial practices to protect assets and ensure financial security."
Seven of Wands,finance,"The Seven of Wands in finance symbolizes success through strategic investments, emphasizing the importance of financial foresight and planning to maintain stability. It encourages perseverance and confidence in overcoming challenges and warns of potential jealousy from others regarding your financial achievements."
Six of Cups,finance,"The Six of Cups in finance emphasizes the importance of sharing resources within family settings, often through gifts, donations, or living arrangements. It encourages reflecting on past financial experiences to guide future decisions, offering potential benefits from inheritance or charitable acts. This card suggests that financial improvements can arise from family support and revisiting familiar financial patterns."
Six of Pentacles,finance,"The Six of Pentacles signifies a period of financial generosity and community support, emphasizing the potential for both giving and receiving assistance. It suggests a supportive environment that fosters financial growth and shared success, particularly for entrepreneurial ventures. Your passion and hard work can inspire others, leading to mutual assistance and financial rewards, enabling you to help others financially."
Six of Swords,finance,"The Six of Swords in a financial context signifies a transition from past difficulties to a phase of stability and growth. It emphasizes the importance of learning from previous financial mistakes, embracing change, and maintaining vigilance and responsibility to ensure a secure and prosperous financial future."
Six of Wands,finance,The Six of Wands signifies financial success and stability achieved through dedication and perseverance. It emphasizes the importance of appreciating achievements while maintaining moderation in spending and warns against overconfidence. This card highlights a favorable period for investments and underscores the need for responsible financial management.
Star,finance,"The Star card emphasizes the importance of faith, positivity, and gratitude in achieving financial success. It suggests that maintaining hope and a positive outlook can lead to prosperity, even during challenging times. Additionally, the card advises exercising caution to avoid emotional influences in financial decisions."
Strength,finance,"The Strength card in finance highlights that disciplined spending fosters financial stability and comfort. It underscores the importance of resilience, courage, and emotional control in navigating financial challenges. Although there is potential for bold decisions and growth, caution against unnecessary expenses and risky investments is essential."
Sun,finance,"The Sun card in financial readings signifies a period of abundance and success, emphasizing the importance of confidence and optimism in achieving financial goals. It suggests that hidden financial elements may be revealed, offering clarity and opportunities for growth and independence. This card encourages embracing positivity to attract wealth and celebrate financial achievements."
Temperance,finance,"The Temperance card in finance consistently emphasizes the importance of a balanced and moderate approach, advocating for diligent saving combined with mindful spending. By avoiding financial extremes and exercising patience and self-control, individuals can achieve long-term stability and harmony in their financial lives."
Ten of Cups,finance,"The Ten of Cups consistently underscores the theme of family harmony and financial security, even without substantial wealth. It suggests that past financial disputes may be resolved, leading to emotional and financial fulfillment. The card encourages gratitude for the current stability and abundance, while hinting at a promising and stable financial future."
Ten of Pentacles,finance,"The Ten of Pentacles symbolizes financial success, often achieved through family inheritance or unexpected gains. It emphasizes the importance of future financial planning and creating a lasting legacy for loved ones. The card encourages celebrating prosperity, managing resources wisely, and exploring opportunities in real estate."
Ten of Swords,finance,"The Ten of Swords in finance highlights a bleak financial situation characterized by failed investments and losses. To navigate this challenging period, it's crucial to cut unnecessary expenses, avoid risks, and exercise caution with financial decisions. Despite feelings of betrayal and defeat, resilience and careful management can facilitate recovery and prevent further financial ruin."
Ten of Wands,finance,"The Ten of Wands in a financial context signifies overwhelming pressure and stress due to financial obligations, such as debts or large expenses. It advises against making rash decisions and highlights the importance of evaluating your financial situation thoroughly. Seeking professional guidance is recommended to help navigate these challenges effectively and ensure long-term financial stability."
Three of Cups,finance,"The Three of Cups in a financial context signifies a period of joy and prosperity, encouraging celebration and gratitude for financial achievements. However, it emphasizes the importance of balancing enjoyment with financial responsibility, particularly as social and collaborative activities gain prominence. Maintaining this balance is crucial to ensure long-term financial stability and continued success."
Three of Pentacles,finance,"The Three of Pentacles in finance underscores the importance of seeking financial expertise or engaging in self-education to improve financial management. This approach facilitates effective budgeting and the achievement of material goals, ensuring a secure and rewarding financial future."
Three of Swords,finance,"The Three of Swords in finance signals financial stress and potential loss, often stemming from emotionally charged events like breakups, divorce, or personal conflicts. It highlights the pain arising from these challenges and underscores the importance of resilience in addressing them. Seeking support and formulating a strategic plan to manage financial issues can be pivotal during this time. While the current situation may feel overwhelming, this card reassures that healing and financial recovery are achievable with time and perseverance."
Three of Wands,finance,"The Three of Wands in finance signifies a time of financial rewards and growth, where hard work results in prosperity. It advises using these gains for personal development through travel or education, while confidently embracing new financial opportunities to ensure ongoing success."
Tower,finance,"The Tower card in the financial context warns of potential sudden disruptions and resource loss, highlighting the importance of having savings and a support system. While these changes may initially seem chaotic and destructive, they also present opportunities for growth and transformation if handled with caution and preparedness. Emphasizing financial caution, the card advises against risky decisions and impulsive spending to navigate through potential upheavals effectively."
Two of Cups,finance,"The Two of Cups in a financial context emphasizes stability, balance, and the importance of prudent financial management. It suggests that forming partnerships and collaborating with others can lead to financial success through mutual trust and shared resources. While it does not promise wealth, the card highlights the value of responsible financial practices and the benefits of cooperative efforts in maintaining financial well-being."
Two of Pentacles,finance,"The Two of Pentacles in finance consistently underscores the necessity of adaptability and balance in managing financial challenges. Despite experiencing uncertainties and the stress of decision-making, maintaining flexibility and resourcefulness is crucial for overcoming temporary financial difficulties. By embracing these qualities, one can achieve stability and successfully navigate through periods of financial juggling and strain."
Two of Swords,finance,"The Two of Swords in finance emphasizes themes of denial and indecision, urging individuals to confront their financial realities with clarity and rationality. It highlights the necessity of making difficult financial decisions to overcome stagnation and suggests that trusting one's intuition and seeking professional advice can be beneficial in managing financial challenges."
Two of Wands,finance,"The Two of Wands in finance consistently represents a stable and comfortable financial situation that supports confident long-term planning. It emphasizes the need for strategic decision-making, careful resource evaluation, and smart investments to secure future prosperity and financial success."
Wheel of Fortune,finance,"The Wheel of Fortune card in finance consistently emphasizes the inevitability of change, highlighting the need for adaptability and preparedness. It advises saving during prosperous times to manage future challenges and encourages vigilance for new opportunities. The card recognizes the influence of luck and destiny, indicating potential for both unexpected gains and expenses, thus advocating for wise financial decisions."
World,finance,"The World card in finance signifies reaching significant milestones and enjoying the rewards of hard work. It emphasizes celebrating successes, understanding the role of finances within the broader life context, and planning for future growth. The card advises against speculative risks, promoting stability and informed financial decision-making."
Ace of Cups,love,"The Ace of Cups in love readings indicates the emergence of new emotions, offering the promise of new relationships or deeper intimacy for both singles and couples. It emphasizes emotional and spiritual growth, highlighting the importance of intuition and emotional decision-making. Careful nurturing of relationships is encouraged to foster meaningful connections."
Ace of Pentacles,love,"The Ace of Pentacles in love readings symbolizes stability, prosperity, and new beginnings. It encourages secure and independent relationships where partners maintain strong connections, and singles are advised to focus on building solid, practical foundations for love. However, the card cautions against allowing material concerns to overshadow genuine intimacy and connection."
Ace of Swords,love,"The Ace of Swords in love readings highlights the crucial role of clear, honest communication and intellectual engagement in relationships. Directly addressing issues can lead to breakthroughs, deeper understanding, and a stronger bond. The card also advises removing toxic influences to foster clarity and personal growth in your romantic life."
Ace of Wands,love,"The Ace of Wands in love tarot readings symbolizes a dynamic and passionate phase, marked by excitement, sensuality, and potential for deeper emotional connections. It suggests the revival of passion in committed relationships and significant developments like engagements or family planning, while encouraging singles to pursue romantic opportunities. Overall, it highlights an invigorating period of growth and bold romantic actions."
Chariot,love,"The Chariot card in love emphasizes the importance of taking control of your romantic life by clearly understanding your desires and acting with confidence. Success in love requires balancing conflicting urges, symbolized by the two horses, and encourages examining past choices to ensure they are balanced. It advocates for determined self-direction and reflection to maintain a clear and balanced path forward."
Death,love,"The Death tarot card in love readings signifies being caught in ineffective emotional patterns, highlighting the necessity of change. This change can either lead to the end of a relationship or its positive transformation, fostering growth and opening new opportunities. It also represents the potential for profound renewal and rebirth within partnerships. For singles, it encourages letting go of outdated beliefs and releasing past attachments to embrace new emotional possibilities, paving the way for healthier and more fulfilling relationships."
Devil,love,"The Devil card in love readings symbolizes lust, temptation, and hedonism, urging individuals to enjoy life's pleasures responsibly while maintaining open communication to prevent misunderstandings and harm. It also highlights the complexities of passion and attachment, warning against co-dependency and unhealthy power dynamics. The card encourages self-awareness, mutual respect, and recognizing limiting beliefs or behaviors to break free from them. Balancing relationship involvement with personal interests remains crucial, with a focus on clear intentions and emotional boundaries as a foundation for authentic and liberating connections."
Eight of Cups,love,"The Eight of Cups in a love context emphasizes the need for honest self-reflection regarding the fulfillment, happiness, and personal growth within a relationship. It advises individuals to assess whether their partnership truly adds value to their life and if they envision a future together, rather than staying out of fear of loneliness or starting anew. Courage is essential to confront these truths and potentially move on from an unfulfilling relationship."
Eight of Pentacles,love,"The Eight of Pentacles in love signifies the importance of dedication, self-improvement, and empathy in nurturing relationships. Discovering new aspects of your partner can deepen the bond, while balancing work and personal life is crucial to maintaining emotional intimacy. For singles, reflecting on past experiences is vital for building successful future relationships."
Eight of Swords,love,"The Eight of Swords in love readings consistently highlights feelings of entrapment and self-imposed limitations within relationships. It stresses the importance of assertive communication, introspection, and self-awareness to overcome these perceived barriers, whether in a current partnership or while single. Achieving personal empowerment and fostering healthier connections requires taking proactive steps to address and resolve these challenges."
Eight of Wands,love,"The Eight of Wands in a love context indicates a period of renewed energy, excitement, and swift changes. For singles, it suggests the potential for a fast-paced romantic development, while couples may experience positive surprises that invigorate and strengthen their connection. Embracing this dynamic energy is encouraged to enhance intimacy and advance romantic situations."
Emperor,love,"The Emperor card in love readings emphasizes the need for logic, discipline, and structure, which can help maintain balance but may also result in traditional and stifling relationship dynamics. It frequently represents an older, well-established individual who struggles with emotional expression and may exhibit controlling or domineering tendencies."
Empress,love,"The Empress card in love readings symbolizes nurturing, love, and financial security, fostering stable and committed relationships. It suggests a harmonious blend of love and work, with potential connections through business, and emphasizes themes of motherhood and family. The card highlights emotional expression, creativity, and generosity, supporting an abundant and harmonious life."
Five of Cups,love,"The Five of Cups in love signifies a time of emotional loss and mourning, often due to breakups or conflicts. Despite the sadness, the card encourages finding hope in what remains and emphasizes the importance of learning from past experiences to foster better communication and personal growth. It advises overcoming past regrets and fears to ensure healthier and more fulfilling future relationships."
Five of Pentacles,love,"The Five of Pentacles in love readings indicates a challenging period marked by financial hardship, feelings of isolation, and communication issues. These difficulties can impact both singles and couples, often resulting in emotional distance and rejection. Despite these challenges, the card stresses the importance of providing emotional support and maintaining unity to overcome such hardships."
Five of Swords,love,"The Five of Swords in love readings indicates unexpected changes and a tense atmosphere that can lead to conflicts and arguments. It stresses the importance of avoiding ego-driven disputes and prioritizing compromise to maintain harmony and balance. Poor communication can escalate issues, potentially leading to infidelity and separation, making it essential to handle conflicts carefully."
Five of Wands,love,"The Five of Wands in love emphasizes the need for proactive engagement. Singles may face competition for a partner's affection and should approach the situation subtly to avoid being overly assertive. Couples might encounter minor conflicts, which should be handled playfully to prevent escalation and maintain a joyful relationship."
Fool,love,"The Fool card in love readings emphasizes embarking on new romantic adventures, advocating for exploration, risk-taking, and openness to new experiences and relationships. It advises maintaining confidence and positivity, even in the face of potential rejection, while highlighting spontaneity and joy in love. Additionally, it cautions about commitment issues and encourages self-love and liberation, especially for those in unhealthy relationships."
Four of Cups,love,"The Four of Cups in love signifies a stage of boredom and indifference, affecting both singles and those in relationships, often due to past hurts or unattained ideals. To find or rekindle love, it is crucial to overcome fears, seize opportunities, and appreciate current relationships through mutual effort and openness. Embracing possibilities and valuing present connections can significantly enhance one's love life."
Four of Pentacles,love,"The Four of Pentacles in love readings highlights the dangers of possessiveness, fear of change, and control issues, which can damage relationships. It underscores the importance of resolving past emotional baggage and not clinging too tightly, to foster genuine intimacy and openness to new romantic possibilities. Embracing these changes can lead to healthier and more fulfilling connections."
Four of Swords,love,"The Four of Swords in love consistently underscores the need for rest, self-reflection, and personal space. Whether single or in a relationship, taking time to recharge and contemplate personal desires helps manage emotional stress and fosters deeper, more fulfilling connections. The card highlights the importance of self-care and introspection to overcome anxiety and strengthen romantic bonds."
Four of Wands,love,"The Four of Wands in love readings signifies joyous family and community gatherings, such as engagements and weddings, which strengthen bonds and relationships. It highlights stability and deepening connections for those in relationships, supported by family and friends. For singles, the card suggests the possibility of finding love during social events and even reunions with past lovers."
Hanged Man,love,"The Hanged Man in love underscores the need for patience and reflection, advising singles to refrain from rushing into relationships and instead use solitude for personal growth and gaining new perspectives. In existing relationships, timing and sacrifice are crucial, as they can test and ultimately strengthen bonds. Dissatisfaction in a relationship may necessitate taking a step back to reassess its direction and consider necessary adjustments."
Hermit,love,"The Hermit card in love emphasizes the necessity of self-reflection and understanding, whether single or in a relationship. Solitude facilitates personal growth, preparing individuals for meaningful and authentic connections. For couples, engaging in shared introspection and open communication is essential to strengthen their bond and face future challenges."
Hierophant,love,"The Hierophant card in love readings consistently underscores the importance of traditional, community-respected relationships, often signaling commitment and marriage. It emphasizes shared values and beliefs, alongside moral and spiritual treatment of partners. The card advises maintaining stability and understanding, favoring conventional paths in forming and maintaining relationships."
High Priestess,love,"The High Priestess card in love readings underscores subtle emotional changes and emphasizes the importance of intuition and honesty. It suggests growing intimacy and openness in relationships, with hidden emotions eventually surfacing. This card also highlights the need for patience and emotional depth, paving the way for profound connections built on mutual understanding and authenticity. For men, it indicates attraction to an alluring and enigmatic woman, while for women, it points to the presence of admirers or emotional introspection, encouraging openness and transparency for deeper relationships."
