card,topic,summary
Ace of Cups,career,"The Ace of Cups in a career context signifies new beginnings and emotional growth, offering opportunities for creative ventures and enhanced work relationships. It encourages pursuing passions with enthusiasm while maintaining a balance between emotional fulfillment and practicality. This card advises overcoming fears, embracing new responsibilities, and staying grounded amidst potential challenges or negativity from others."
Ace of Pentacles,career,"The Ace of Pentacles in a career context highlights new opportunities that promise promotions, job satisfaction, and financial success. It marks the start of a positive phase, encouraging proactive efforts toward achieving career goals. Balancing material achievements with personal values and well-being is crucial for overall fulfillment."
Ace of Swords,career,"The Ace of Swords in a career context symbolizes new beginnings that offer intellectual growth and challenges. It highlights the importance of clarity, insight, and effective communication within a supportive and dynamic environment. The card suggests success through critical thinking, adaptability, and clear goal articulation in roles that involve leadership and idea exchange."
Ace of Wands,career,"The Ace of Wands in a career reading signifies a period of growth and new opportunities, where preparation and inspiration converge. It encourages pursuing new ventures with enthusiasm, creativity, and bold action, while maintaining focus and balance to avoid impulsiveness. Success and professional advancement are anticipated if challenges are met innovatively."
Chariot,career,"The Chariot card in a career reading consistently emphasizes ambition, clear goals, and determination as essential for achieving success. It advocates for disciplined pursuit of career objectives while steering clear of distractions, and highlights the importance of balancing assertiveness with integrity. The card also suggests potential opportunities for advancement and academic achievements."
Death,career,"The Death card in career readings symbolizes the necessity of embracing change and transformation when feeling unfulfilled or stagnant in your job. It marks the completion of an old stage, urging you to proactively pursue new opportunities. Letting go of past attachments and stability is essential to achieve professional growth and success. By adapting to change and taking decisive actions, you can open doors to new beginnings and greater career satisfaction."
Devil,career,"The Devil card in a career context consistently highlights feelings of being trapped and limited by external and internal factors. It brings attention to issues of careerism and addiction to money, encouraging individuals to reclaim personal power, address limiting beliefs, and balance work with personal life. The card advises against overextending oneself and stresses aligning career paths with personal values while being mindful of risks."
Eight of Cups,career,"The Eight of Cups in a career reading signifies the need to move away from unfulfilling or restrictive work environments. It encourages self-discovery and aligning one's career with personal values, whether through taking a break, relocating, or making a complete career change. The card emphasizes responsible decision-making to achieve personal and professional growth."
Eight of Pentacles,career,"The Eight of Pentacles in a career context signifies the importance of dedication, skill enhancement, and mastery, predicting success through promotions, business growth, or academic achievements. It emphasizes continuous learning and craftsmanship while advising a balance between quality and efficiency, cautioning against perfectionism. Overall, this card is a favorable omen for career advancement, recognition, and leadership growth."
Eight of Swords,career,"The Eight of Swords in a career context represents feeling trapped and dissatisfied with your job, primarily due to financial dependencies. Despite anxiety making you feel constrained, you actually possess more options than you realize. By seeking help, reassessing your finances, and considering creative solutions like education or turning a hobby into a business, you can find ways to improve your career situation."
Eight of Wands,career,"The Eight of Wands in a career context symbolizes rapid progress and movement, potentially involving travel or significant advancement in your professional life. It emphasizes a sense of growth, excitement, and achievement, encouraging you to seize opportunities while maintaining focus. Planning for future endeavors and ensuring personal well-being are essential for sustaining this momentum."
Emperor,career,"The Emperor card in a career context emphasizes the importance of leadership, discipline, and organization. It advises taking initiative to improve efficiency and structure at work while balancing authority with empathy. The card suggests seeking roles that allow for creative freedom and respect for one's ideas, highlighting professionalism and hard work as keys to career success."
Empress,career,"The Empress card in these interpretations highlights a period of creativity, growth, and nurturing in your career, emphasizing the creation of a supportive and harmonious work environment. Success is likely in roles that leverage creativity and nurturing qualities, but it is important to maintain personal boundaries to avoid overextending yourself. This is an opportune time to pursue new projects, with the promise of professional abundance and development."
Five of Cups,career,"The Five of Cups in a career context signifies loss and disappointment, urging individuals to acknowledge their emotions and learn from these challenges. It focuses on accepting the irreversibility of loss, emphasizing the importance of maintaining positive relationships and cultivating resilience and gratitude to transform setbacks into opportunities for growth and new beginnings."
Five of Pentacles,career,"The Five of Pentacles in a career context signals significant challenges, including job loss and feelings of isolation, which can adversely impact mental health and financial stability. It underscores the need to confront fears, seek support, and explore new opportunities to navigate these difficulties. Cultivating a positive and grateful mindset is essential for overcoming these obstacles and achieving a more secure and fulfilling career path."
Five of Swords,career,"The Five of Swords in a career context indicates workplace conflicts, hostility, and power struggles, often arising from poor communication. It emphasizes the importance of maintaining professional conduct, self-awareness, and strategic resolution to address these challenges effectively. While assertiveness and standing up for oneself are crucial, keeping composure and focusing on constructive solutions are essential for navigating such situations."
Five of Wands,career,"The Five of Wands in a career context signifies the presence of conflict and competition, which may be inherent in your industry or arise from temporary challenges. It emphasizes the need for resilience, diplomacy, and strategic action in navigating these professional obstacles. Success is attainable if you actively address and resolve these conflicts while maintaining fairness and asserting your position."
Fool,career,"The Fool card in a career reading signifies new beginnings and opportunities, such as job changes, promotions, or revitalizing current projects with fresh energy and ideas. It encourages embracing innovation and taking bold actions, emphasizing the importance of courage and a proactive mindset for professional growth and independence. This card urges individuals to seize chances for advancement and self-dependence with bravery and initiative."
Four of Cups,career,"In a career context, the Four of Cups symbolizes feelings of boredom, stagnation, and disconnection at work, often exacerbated by jealousy and apathy. It encourages introspection to uncover the root causes of dissatisfaction and advises seeking new opportunities to reignite passion and productivity. Focusing on personal growth, gratitude, and self-awareness can help overcome these challenges and lead to positive change."
Four of Pentacles,career,"The Four of Pentacles in a career context signifies stability and security but warns against insecurity and defensiveness that can hinder collaboration and growth. It emphasizes the importance of prudent resource management and being open to new opportunities to ensure progress. Additionally, the card cautions against staying in unfulfilling roles out of fear, highlighting the need for balance and adaptability to avoid isolation and stagnation."
Four of Swords,career,"The Four of Swords in a career context underscores the critical need for rest and self-care due to stress and burnout. It advises taking time off to recharge, ensuring a refreshed and focused return to work. Additionally, it highlights the importance of evaluating whether your current career aligns with your well-being and happiness."
Four of Wands,career,"The Four of Wands in a career context signifies stability, success, and supportive relationships within a positive work environment. It emphasizes the importance of community and teamwork, encouraging the celebration of achievements and the recognition of support from colleagues. The card advises maintaining enthusiasm and avoiding complacency while strengthening bonds through upcoming work events and celebrations."
Hanged Man,career,"The Hanged Man in a career context represents a phase of waiting and uncertainty, advising patience and introspection. It highlights the value of accepting pause as a part of growth, suggesting that forcing changes is often ineffective. Embracing the present moment and shifting perspectives fosters growth and clarity. Although career transitions may initially appear as setbacks, they can ultimately realign one's path toward greater fulfillment and satisfaction."
Hermit,career,The Hermit card in career readings signifies a period of introspection and reevaluation due to dissatisfaction with the current career path. It encourages seeking work that brings personal fulfillment beyond financial stability and highlights the importance of balancing solitude for reflection with maintaining meaningful social connections. This card advocates for aligning career choices with deeper personal goals and aspirations.
Hierophant,career,"The Hierophant card in career readings highlights the importance of collaboration, tradition, and mentorship for achieving success. It advises maintaining conventional approaches, seeking guidance from mentors, and engaging in educational pursuits to enhance career growth. While emphasizing the value of tradition and conformity, it also warns against losing personal authenticity in the process."
High Priestess,career,"The High Priestess card in career readings emphasizes the importance of education, inspiration, and intuition. It suggests trusting instincts for making significant career decisions, while mentorship and self-reliance play crucial roles in uncovering opportunities. Patience, motivation, and introspection are essential for achieving career success and advancement."
Judgement,career,"The Judgement card in a career context signals a period of awakening and transformation, leading to a discovery of a new purpose or calling that may necessitate workplace changes. These adjustments, though challenging, can revitalize your professional life. It's important to be mindful of how your actions affect others, take responsibility for conflicts, and embrace roles aligned with your higher purpose while maintaining compassion."
Justice,career,"The Justice card in career readings emphasizes the critical role of integrity, fairness, and accountability in professional dealings. It advocates for ethical behavior, openness to diverse perspectives, and balancing personal and professional life to foster career success and build trust. The card also highlights the importance of roles that promote fairness and social responsibility, such as those in law or advocacy, while advising against rigidity and underscoring the need to prioritize personal well-being alongside career ambitions."
King of Cups,career,"The King of Cups in a career context highlights the importance of emotional maturity and compassionate leadership, often aided by mentorship. It emphasizes balancing emotional and practical needs, succeeding in empathetic or creative roles, and maintaining financial stability while fostering respect and harmony in the workplace."
King of Pentacles,career,"The King of Pentacles in a career context represents success, stability, and prosperity, often supported by mentorship from an experienced individual. It emphasizes wise decision-making and maintaining integrity in professional pursuits, with particular opportunities for growth in business or finance. This card suggests that trust in one's abilities and balanced strategies can lead to career advancements and solutions for financial challenges."
King of Swords,career,"The King of Swords in a career context emphasizes high standards, intellectual leadership, and principled action. Representing either a mentor or a pivotal career phase, it advocates for excelling through analytical thinking, integrity, and structured routines. Balancing authority with collaboration is essential for achieving professional success and earning respect."
King of Wands,career,"The King of Wands in career interpretations symbolizes a successful and influential leadership role, characterized by vision, strategic growth, and respect. It highlights the importance of balancing confidence with humility and encourages leveraging this prosperous period for long-term and sustainable success. Collaboration and the support of others are also emphasized as key components in achieving enduring professional accomplishments."
Knight of Cups,career,"The Knight of Cups in a career context highlights the significance of using diplomacy, creativity, and emotional intelligence to navigate professional challenges. It suggests potential success in creative fields and emphasizes the importance of balancing dreams with practicality to seize promising opportunities and achieve positive outcomes. This card encourages leveraging intuition and empathy to resolve conflicts and improve both professional and financial situations."
Knight of Pentacles,career,"The Knight of Pentacles in a career context symbolizes ambition, dedication, and a disciplined work ethic, advocating for a steady, patient approach towards long-term goals. It emphasizes the importance of hard work, reliability, and practical skills in achieving success, while also encouraging openness to new opportunities and caution against excessive risk aversion. Success may not be immediate, but consistent effort and a focus on stability can lead to professional fulfillment."
Knight of Swords,career,"The Knight of Swords in a career context emphasizes ambition, determination, and assertiveness as essential traits for achieving success. It encourages individuals to take bold actions and pursue their career goals with confidence, aiming for advancements like promotions or new roles. However, maintaining diplomacy alongside assertiveness is crucial to earning respect and ensuring long-term success."
Knight of Wands,career,"The Knight of Wands in career readings embodies enthusiasm, ambition, and a readiness for new challenges. It signifies an opportune time to start new ventures or take on responsibilities, emphasizing the importance of leadership and innovation. However, to effectively harness this card's energy, one must proactively seek out opportunities and exercise caution to avoid impulsiveness and frustration from stagnation."
Lovers,career,"The Lovers card in a career context symbolizes the need for significant decision-making, often involving potential partnerships that can be either platonic or romantic. It highlights the importance of aligning career choices with personal values and passions while balancing logic and emotion. The card suggests that even seemingly undesirable changes can lead to growth, emphasizing the necessity of informed and thoughtful decisions in professional life."
Magician,career,"The Magician card in career readings highlights the potential for success through decisive actions and manifestation, supported by willpower and ambition. It advises caution when dealing with colleagues or partners, as they may not always be transparent. Even when success seems assured, a wise and cautious approach is recommended."
Moon,career,"The Moon card, when interpreted in the context of career, consistently reveals themes of uncertainty and confusion that create a tense work environment. Miscommunication and a lack of necessary information are common obstacles that can hinder decision-making. To effectively navigate these challenges, it is crucial to rely on clear communication and intuition, seeking guidance to distinguish between reality and illusion."
Nine of Cups,career,"The Nine of Cups in a career context signifies a period of recognition, success, and fulfillment, offering an ideal opportunity for career advancement, such as raises or promotions, due to a receptive environment. While experiencing professional prosperity and contentment, it's important to maintain humility and continue striving for greater achievements. This card encourages celebrating accomplishments while remaining open to further growth and challenges."
Nine of Pentacles,career,"The Nine of Pentacles signifies career success and financial stability achieved through hard work and dedication. It emphasizes the importance of enjoying the rewards of your labor, whether through relaxation, retirement, or leisure, while encouraging gratitude and generosity to avoid materialism. This card highlights the balance between personal achievement and the positive impact of sharing success with others."
Nine of Swords,career,"The Nine of Swords in a career context highlights significant stress and anxiety, potentially intensified by paranoia or fear. It underscores the importance of confronting these emotions with mindfulness and self-compassion rather than relying solely on positive thinking. Seeking support and considering career changes if stress is externally driven can help. Professional guidance can be invaluable in managing internal stress and preventing burnout."
Nine of Wands,career,"The Nine of Wands in a career context symbolizes resilience and determination in overcoming challenges, urging individuals to persevere despite exhaustion. It highlights the importance of remaining open-minded and adaptable to new opportunities, while ensuring that current struggles are temporary and will lead to eventual relief and success. This card serves as a reminder to draw on inner strength and continue pushing forward, as the end of struggles is near and will bring rewards."
Page of Cups,career,"The Page of Cups in a career context emphasizes the significance of creativity, intuition, and balancing dreams with practical actions. It encourages individuals to pursue creative and artistic interests while remaining grounded and taking proactive steps towards career goals. Addressing workplace challenges constructively and prioritizing personal happiness and fulfillment are also key aspects to achieving professional success."
Page of Pentacles,career,"The Page of Pentacles in a career context emphasizes the importance of setting a strong foundation through planning and action. It encourages seizing opportunities, potentially through higher education, while highlighting ambition, practical skills, and the necessity of flexibility and openness to change. Balancing hard work with necessary breaks is crucial for managing stress and achieving personal and professional growth."
Page of Swords,career,"The Page of Swords in a career context emphasizes a period of learning or new beginnings, characterized by intelligence, creativity, and ambition. You are driven to explore new ideas and opportunities with curiosity and enthusiasm, often necessitating further education or experience to achieve your goals. Success is attainable through focus, patience, and the ability to transform ideas into actionable outcomes."
Page of Wands,career,"The Page of Wands in a career context signifies a period ripe with new opportunities and ventures that promise success and fulfillment. This card encourages embracing creativity and innovation while taking calculated risks, yet it advises against impulsiveness, underscoring the need for thorough preparation and focus on long-term goals to realize one's full potential and growth."
Queen of Cups,career,"The Queen of Cups in a career context highlights the need for both emotional fulfillment and financial stability. It suggests involvement in nurturing roles, such as caregiving or counseling, and emphasizes the presence of compassionate figures who offer support and guidance. This card encourages trusting your intuition, maintaining emotional well-being, and setting healthy boundaries to create a positive professional environment."
Queen of Pentacles,career,"The Queen of Pentacles in a career context symbolizes success, practicality, and nurturing, embodying the qualities of a skilled and organized leader. Her presence as a mentor or partner provides invaluable support and guidance, fostering a harmonious work environment that promotes growth and prosperity. However, it is crucial to balance material success with personal well-being and integrity to achieve long-term fulfillment in one’s career."
Queen of Swords,career,"In a career context, the Queen of Swords signifies wisdom, clarity, and integrity, representing either a senior figure or oneself. It highlights the importance of effective communication and empathy, which lead to respect and success. This card encourages the use of intelligence and insight for leadership and decision-making while remaining open-minded and adaptable."
Queen of Wands,career,"The Queen of Wands in a career context signifies leadership, energy, and creativity, placing you in a position of influence where you inspire others with your passion and vision. This card advises fostering collaboration and respect to create a supportive work environment while cautioning against being overly controlling. Use this period to achieve professional growth and help those around you advance as well."
Seven of Cups,career,"The Seven of Cups in a career context represents a wide array of opportunities, which can lead to both excitement and confusion. To achieve meaningful career progress, it is crucial to evaluate these options carefully, choose a path with clarity, and commit to practical actions while avoiding excessive fantasizing. Success hinges on decisive action and maintaining focus to transform potential into reality."
Seven of Pentacles,career,"The Seven of Pentacles in career readings emphasizes ongoing progress, even if not immediately visible, and the importance of evaluating achievements to refine strategies. It stresses the need for patience, long-term planning, and disciplined efforts aligned with career goals, advising against impulsive actions. By focusing on meaningful and strategic paths, individuals can build a strong foundation for future success."
Seven of Swords,career,"The Seven of Swords in a career context warns of potential deceit and betrayal from coworkers, urging caution in whom you trust and share information with. Strategic and adaptive thinking is crucial for navigating challenges and protecting personal interests, while maintaining integrity and transparency is essential. This card emphasizes the need to be vigilant and prepared to address unexpected sources of deception."
Seven of Wands,career,"The Seven of Wands in a career reading signifies the importance of resilience and confidence when facing challenges. It encourages defending your beliefs and values while maintaining integrity, despite potential envy or opposition. This card underscores the need for perseverance and authenticity to overcome obstacles and achieve career success."
Six of Cups,career,"The Six of Cups in a career reading emphasizes the importance of reflecting on past experiences to learn valuable lessons and guide future growth. It suggests reconnecting with former colleagues or considering a return to a previous role, while promoting nostalgia, generosity, creativity, and collaboration. The card advocates for roles involving mentorship and teamwork, fostering meaningful professional relationships and personal development."
Six of Pentacles,career,"The Six of Pentacles in a career context represents support, generosity, and mutual growth, highlighting the role of mentorship and the value of your contributions at work. It suggests opportunities for career advancement and unexpected success, with promising prospects for job seekers and business owners. This card emphasizes the importance of balanced giving and receiving, encouraging empowerment and collaboration toward common goals."
Six of Swords,career,"The Six of Swords in a career context signifies a transition from a stressful work phase to a more relaxed and fulfilling period. This transition involves steady progress and may include moving into roles that are better suited to your abilities. Embracing change, staying open-minded, and trusting the process are essential components for achieving career growth and success."
