card,topic,summary
Six of Wands,career,"The Six of Wands in a career context represents success, recognition, and self-confidence, often leading to promotions or raises. It highlights the importance of appreciating the support from peers and superiors while celebrating achievements. The card also suggests opportunities in leadership and mentorship roles, encouraging humility and the inspiration of others."
Star,career,"The Star card in career readings represents hope, inspiration, and the potential for achieving ambitions. It emphasizes the importance of maintaining positivity and faith to attract opportunities and success, particularly in creative fields. The card also indicates a period of healing after stress and highlights the need for balancing dreams with practical actions and discipline."
Strength,career,"The Strength card in a career context highlights the necessity of channeling instincts and emotions constructively to achieve professional success. It underscores the need for courage, confidence, and decisive action to overcome challenges, whether seeking advancement, changing career paths, or starting a business. Trust in your abilities, assert yourself confidently, and make informed and wise decisions."
Sun,career,"The Sun card in a career context represents a phase of success, optimism, and fulfillment, highlighting growth, recognition, and the achievement of professional goals. It encourages pursuing these goals with enthusiasm and confidence while maintaining humility and gratitude. This card suggests smooth progress in professional endeavors, whether through job changes, promotions, or educational advancements, and fosters a supportive work environment."
Temperance,career,"The Temperance card in career readings emphasizes the need for patience, moderation, and balance, advocating for a steady and gradual approach to achieving professional goals. It advises avoiding extremes, promoting adaptability, and integrating work with other life aspects while highlighting the importance of diplomacy and cooperation. Success is seen as a result of consistent effort and emotional composure."
Ten of Cups,career,"The Ten of Cups in a career context represents a harmonious and supportive work environment with opportunities for growth and strong relationships. It emphasizes the importance of balancing work and personal life, potentially indicating a shift towards family priorities or retirement. Financially, it suggests success and positive outcomes."
Ten of Pentacles,career,"The Ten of Pentacles in career readings consistently emphasizes stability, long-term financial security, and the potential to build a lasting legacy, whether through personal business ventures or secure positions in traditional companies. It encourages celebrating achievements while maintaining a balance between material success and personal relationships, and highlights opportunities for career advancement and community involvement. This card advocates for creating something enduring, such as a family business, and underscores the importance of engaging with the community while pursuing career growth."
Ten of Swords,career,"The Ten of Swords in a career context symbolizes endings, betrayal, and exhaustion, frequently stemming from office politics or overwork. Despite the painful transitions, it encourages personal growth and the pursuit of new opportunities. Approaching these challenges with resilience and optimism can lead to healing and fresh beginnings."
Ten of Wands,career,"The Ten of Wands in a career context emphasizes feeling overwhelmed and burdened by work responsibilities. It highlights the necessity of collaboration, delegation, and seeking support to effectively manage stress and workload. Balancing professional duties with personal well-being is crucial to prevent burnout and maintain quality in work."
Three of Cups,career,"In the career context, the Three of Cups represents joyous celebrations and acknowledgment of work-related achievements and milestones. It signifies a positive and collaborative work environment where teamwork thrives, encouraging a balance between social engagement and maintaining productivity. The card suggests opportunities for career advancement and positive developments."
Three of Pentacles,career,"The Three of Pentacles in a career context emphasizes the crucial role of collaboration, where diverse skills and perspectives are united to achieve shared goals. It highlights the importance of teamwork, mutual respect, and dedication as key elements for success. Additionally, this card signifies a period of learning and professional growth, encouraging cooperation over individual recognition."
Three of Swords,career,"The Three of Swords in a career context frequently indicates stress, dissatisfaction, and potential job loss or workplace conflicts. It focuses on the pain arising from conflicts, emphasizing the importance of honest communication and resilience to navigate professional setbacks and heal from them. By acknowledging pain and focusing on growth, individuals can maintain hope and open the door to future opportunities."
Three of Wands,career,"The Three of Wands in a career context signifies expansion, adventure, and new opportunities, particularly in international settings. It encourages making bold decisions, such as working abroad or expanding a business globally, while emphasizing the importance of celebrating achievements with humility to avoid complacency. This card highlights the realization of long-term goals and the continuous pursuit of personal and professional growth."
Tower,career,"The Tower card in a career reading represents sudden upheaval, instability, and stress, often caused by unexpected job changes or external influences. Despite these challenges to professional security, they present opportunities for personal growth, transformation, and improved job prospects. Embracing and adapting to these changes can ultimately lead to a more fulfilling and stable career."
Two of Cups,career,"The Two of Cups in a career context signifies a period of supportive and harmonious professional relationships, highlighting the potential for fruitful collaborations. It emphasizes partnerships built on mutual respect and shared goals, encouraging teamwork and collaboration. However, it advises maintaining personal independence and being cautious about mixing personal and professional relationships."
Two of Pentacles,career,"In a career context, the Two of Pentacles emphasizes the importance of managing multiple responsibilities with balance and adaptability. It highlights resourcefulness, decision-making, and creativity in handling tasks while cautioning against overburdening oneself. Ensuring fair compensation and maintaining a balance between personal and professional life are crucial themes."
Two of Swords,career,"The Two of Swords in a career context highlights conflicts and indecision, whether among colleagues or between career paths. It underscores the importance of gathering information, maintaining objectivity, and confronting fears to make well-informed decisions. This card advises careful consideration and informed decision-making to effectively resolve career challenges."
Two of Wands,career,"**General Summary:** The Two of Wands in a career reading represents a crucial phase of planning and decision-making, highlighting the importance of evaluating ambitions and considering various career paths. It emphasizes setting clear goals and taking decisive actions to transform plans into reality. The card encourages embracing new opportunities and using strategic foresight, while being cautious of indecision."
Wheel of Fortune,career,"The Wheel of Fortune in a career context signifies impending changes and new opportunities, encouraging adaptability and openness to transformation. Embracing challenges and trusting in the natural cycle of change can lead to significant personal and professional growth. This period is marked as an auspicious time for career advancement and success."
World,career,"The World card in a career context signifies the completion and fulfillment of professional goals, whether through satisfying jobs, successful projects, or entrepreneurial ventures. It emphasizes the importance of celebrating these achievements and sharing success with others while remaining open to future opportunities, particularly in roles with global or humanitarian aspects. The card warns against complacency, encouraging ongoing curiosity and the enjoyment of current success."
Ace of Cups,finance,"The Ace of Cups in finance signifies the potential for financial support through social connections and creative ventures, marking the beginning of a promising phase that could lead to both emotional and financial fulfillment. It encourages trusting one's intuition and exploring new opportunities, particularly in investments, while maintaining a balance between accumulating wealth and spending wisely. Seeking guidance and advice is also recommended to avoid potential financial pitfalls. This card highlights not just opportunities but the potential to initiate a transformative journey toward abundance."
Ace of Pentacles,finance,"The Ace of Pentacles symbolizes new financial opportunities and the potential for long-term growth. It encourages nurturing these opportunities through financial education and saving, with the possibility of unexpected financial rewards. This makes it an ideal time for strategic financial planning and investment."
Ace of Swords,finance,"The Ace of Swords in a financial context emphasizes the importance of rational and logical decision-making. It advises prioritizing intellect over emotions, especially when addressing financial requests from others, to ensure decisions are well-informed and align with personal financial goals. By using clear thinking and insight, this card helps avoid long-term negative impacts on financial well-being and relationships."
Ace of Wands,finance,"The Ace of Wands signifies a time of financial relief and potential growth, highlighting opportunities for new ventures and investments. It advises against reckless spending, emphasizing the importance of thoughtful planning and long-term strategies to ensure financial stability and success."
Chariot,finance,"The Chariot card in finance signifies a period of determination and focus to confront and overcome financial challenges. It highlights the potential for financial success and stability through self-discipline and wise investments, particularly in real estate and luxury items. This card indicates a time of possible financial growth and triumph by maintaining focus and making strategic financial decisions."
Death,finance,"The Death card in finance suggests potential financial loss but, more importantly, heralds the end of a financial cycle and the onset of radical change. It encourages releasing outdated financial habits and embracing transformative shifts that open doors to new opportunities, fostering long-term growth and prosperity. During this time, maintaining balance, honesty, and the ability to adapt is crucial for navigating these changes effectively. This card speaks of renewal and the chance to rebuild on stronger foundations."
Devil,finance,"The Devil card in finance readings highlights the detrimental effects of negative financial habits and material entrapment, urging individuals to recognize and break free from these constraints. It emphasizes the importance of self-awareness, flexibility, and resourcefulness to navigate financial challenges and achieve stability and prosperity. By addressing harmful patterns and adapting to changes, one can manage financial stress effectively and work towards a more secure future."
Eight of Cups,finance,"The Eight of Cups in finance emphasizes the need to move away from financial security and outdated habits to seek personal fulfillment. It highlights the importance of careful financial planning, trusting intuition, and being open to change, even if it means starting anew. The card suggests that true satisfaction may require leaving behind comfort and exploring new opportunities."
Eight of Pentacles,finance,"The Eight of Pentacles symbolizes achieving financial success through dedication, hard work, and skill development, often resulting in promotions or business growth that lead to financial independence. It encourages reflecting on past challenges as a source of motivation and emphasizes the importance of sharing financial success with others."
Eight of Swords,finance,"The Eight of Swords in finance signifies feelings of anxiety and perceived limitations, often self-imposed. By objectively reassessing your financial situation and creatively using your skills, you can overcome these challenges. This approach can lead to discovering new income opportunities and improving your financial outlook."
Eight of Wands,finance,"The Eight of Wands in finance represents a period of swift financial changes, characterized by both opportunities for growth and the risk of rapid losses. Success in this phase relies on careful financial management, seizing opportunities, and controlling impulsive spending to maintain stability. By remaining vigilant and strategic, one can navigate this dynamic financial landscape effectively."
Emperor,finance,"The Emperor card in finance consistently highlights the importance of maintaining control, discipline, and responsibility. It advocates for creating a budget and adopting a structured approach to financial management in order to achieve and sustain financial stability. By making wise decisions and regularly reviewing financial activities, future financial concerns can be effectively prevented."
Empress,finance,"The Empress card in the context of finance represents abundance, prosperity, and stability. It suggests a financially comfortable period where generosity towards loved ones is encouraged. The card emphasizes the potential for successful investments and creative ventures to further secure and grow wealth, advocating for a nurturing approach to financial management."
Five of Cups,finance,"The Five of Cups in a financial context signifies economic loss and resource shortages, highlighting the importance of careful spending and maintaining a positive outlook. Despite the setbacks, there are opportunities to rebuild by leveraging existing skills and resources. Emphasizing resilience and focusing on future opportunities are essential for overcoming financial challenges."
Five of Pentacles,finance,"The Five of Pentacles card represents financial difficulties, urging careful budgeting and the importance of seeking help when necessary. It emphasizes the need for support and planning for emergencies to navigate challenging financial times. Additionally, the card warns against materialism and advises financial prudence."
Five of Swords,finance,"The Five of Swords in finance highlights conflicts and potential deception within close relationships, urging caution in financial dealings and trust. It advises reducing luxury expenses and stresses the importance of wise and careful financial management. The card encourages learning from financial challenges to make better decisions in the future."
Five of Wands,finance,"The Five of Wands in financial contexts indicates a temporary phase of instability and conflict, requiring significant effort and assertiveness to manage. This card suggests the need to defend your financial position and prepare for potential disputes, whether with loved ones, strangers, or financial professionals. Success lies in navigating these challenges through hard work and striving for collaborative solutions to maintain financial stability."
Fool,finance,"The Fool card in finance signifies a period characterized by spontaneity and idealism, where spending is motivated by a desire for adventure and exploration. There is a prevailing sense of having ample resources, which reduces financial worries and promotes curiosity and expansiveness. Additionally, the card suggests opportunities for financial growth and resolving money-related challenges."
Four of Cups,finance,"The Four of Cups in finance consistently emphasizes distraction and dissatisfaction caused by envy and comparison to others. It suggests that cultivating gratitude and self-reflection can improve financial well-being and openness to new opportunities. Additionally, the card reflects a broader disillusionment with financial systems and materialism."
Four of Pentacles,finance,"The Four of Pentacles symbolizes financial stability and security, fostering a cautious and frugal approach to money management. It emphasizes the importance of saving for significant future expenses, such as a home or retirement, and suggests the potential for business success and improved social status due to financial comfort."
Four of Swords,finance,"Take a mental break from financial stress by avoiding negative thoughts, and begin addressing financial challenges with a clear and objective evaluation of your situation."
Four of Wands,finance,"The Four of Wands consistently represents financial stability and security across all interpretations, highlighting the importance of celebrating financial achievements and enjoying the peace and abundance they bring. It encourages spending on loved ones, such as through gifts or outings, to strengthen social bonds, provided this spending is done responsibly and within one's financial means."
Hanged Man,finance,"The Hanged Man in finance emphasizes the need for a shift in perspective and patience, suggesting that challenges can be transformed into opportunities through mindfulness and self-compassion rather than mere positive thinking. It advises letting go of material attachments and embracing a spiritual approach to wealth, trusting that consistent effort will eventually lead to financial growth and fulfillment. By practicing mindfulness and detachment from materialism, the card encourages trusting the process and finding peace in the journey toward financial progress."
Hermit,finance,"The Hermit card in finance signifies a need to shift focus from material wealth to introspective evaluation and true fulfillment. It encourages reassessment of financial priorities and career paths, emphasizing the importance of inner wisdom and responsible management for genuine satisfaction. Balancing work with personal happiness and using intuition to guide financial decisions is crucial for lasting contentment."
Hierophant,finance,"The Hierophant card in finance consistently emphasizes the importance of traditional financial practices and institutions, recommending advice from experienced professionals to maintain stability and security. It advises prioritizing saving over spending and warns against risky or unfamiliar financial ventures, although it recognizes that future adaptation to new financial methods may eventually be necessary."
High Priestess,finance,"The High Priestess card in finance emphasizes the importance of maintaining privacy and discretion, trusting your intuition, and thoroughly assessing risks before making any financial decisions. It encourages introspection and reflection on financial goals, advising consultation with trustworthy advisors if uncertainties arise. Overall, it ensures that financial decisions are both instinctive and informed."
Judgement,finance,"The Judgement card in finance highlights the need for introspection, accountability, and caution. It emphasizes evaluating and potentially altering financial habits, aligning actions with personal values and goals, and making informed decisions to avoid pitfalls. By reassessing your relationship with money and remaining vigilant in business dealings, you can secure financial stability and improvement."
Justice,finance,"The Justice card in finance highlights the critical importance of honesty, fairness, and balance in financial dealings. Acting with integrity and maintaining a balanced approach between personal needs and those of others are essential strategies that lead to positive financial outcomes and long-term success. Ethical conduct and fair business practices not only ensure stability but also attract prosperity and good fortune."
King of Cups,finance,"The King of Cups in finance represents stability and security achieved through careful and logical decision-making, balanced with emotional fulfillment. It suggests a leadership role, advocating for wise, empathetic approaches to financial matters and the creation of a legacy of abundance. Additionally, this card may symbolize a mentor or advisor who aids in harmonizing emotional desires with practical needs for sound financial outcomes."
King of Pentacles,finance,"The King of Pentacles represents financial milestones and stability achieved through prudent saving and investing. It emphasizes enjoying the rewards of hard work, being generous with loved ones, and managing resources wisely while remaining cautious of risky financial ventures. This card encourages a balanced approach to wealth, combining indulgence with responsibility and foresight."
King of Swords,finance,"The King of Swords in finance underscores the importance of discipline, logical thinking, and thorough research to achieve financial goals. It highlights the role of authority and leadership in navigating financial challenges, emphasizing rational decision-making and overcoming obstacles to secure success and stability."
King of Wands,finance,"The King of Wands in finance symbolizes a balanced approach to money management, achieved through wise saving and spending habits. It represents financial stability and maturity gained from past struggles, emphasizing leadership and the ability to inspire others. Trust in your financial decisions, remain bold in your pursuits, and enjoy your wealth responsibly while sharing it with others."
Knight of Cups,finance,"The Knight of Cups in finance emphasizes using empathy and creative thinking to resolve monetary issues, advocating for an idealistic and passionate approach to financial goals. It encourages trusting intuition and exploring new opportunities while cautioning against impulsive decisions and highlighting the importance of seeking trustworthy financial advice."
Knight of Pentacles,finance,"The Knight of Pentacles in finance emphasizes a cautious and systematic approach to wealth-building, focusing on safety, reliability, and frugality. It highlights the importance of personal responsibility, logical decision-making, and balancing financial success with generosity towards loved ones. Achieving financial goals requires diligence, perseverance, and avoiding emotional influences in financial decisions."
Knight of Swords,finance,"The Knight of Swords in finance highlights a determined and focused pursuit of financial goals, emphasizing ambition and proactive actions. This card encourages taking risks and embracing opportunities for growth, trusting in one's ability to overcome challenges and achieve prosperity."
Knight of Wands,finance,"The Knight of Wands in finance signals a potential financial gain and advises using this money for travel to enhance personal growth. It emphasizes the importance of ambition and taking calculated risks in pursuing financial success, while cautioning against frivolous or impulsive spending."
Lovers,finance,"The Lovers card in finance underscores the importance of making significant financial decisions, where choosing one option may exclude another, affecting future outcomes. It advises aligning financial choices with personal values and goals to achieve balance and fulfillment. In professional contexts, the card suggests potential beneficial partnerships if approached with care and wisdom."
Magician,finance,"The Magician card in finance represents a period rich with financial opportunities, urging an enthusiastic and creative approach to utilizing personal skills and resources. It emphasizes the importance of strategic money management and aligning with positive energies to enhance financial prospects. This is considered an opportune time for investments and new ventures, promising growth and success."
Moon,finance,"The Moon card in finance cautions against making major financial decisions due to uncertainty and incomplete information. It advises trusting intuition, conducting thorough research, and understanding financial details to navigate possible illusions and deceit. Being vigilant against potential scams and managing finances cautiously is emphasized."
Nine of Cups,finance,"The Nine of Cups is a highly positive card in a financial context, symbolizing contentment, security, and the fulfillment of economic goals. It suggests that diligent efforts lead to substantial rewards, emphasizing the importance of appreciating and enjoying your achievements. Cultivating gratitude for your financial blessings can attract further prosperity and empower you to take control of your financial future."
Nine of Pentacles,finance,"The Nine of Pentacles, in the context of finance, signifies a period of prosperity, stability, and material security, where past investments bring rewards. It suggests an elevation in social status and potential real estate acquisitions, with an emphasis on valuing quality and maintaining financial prudence."
Nine of Swords,finance,"The Nine of Swords in finance consistently highlights significant anxiety and stress, often fueled by irrational fears and exaggerated perceptions of financial problems. This card urges confronting these fears with clarity and rationality, as well as seeking external advice and support to regain perspective. By addressing irrational thoughts and focusing on actionable steps, it becomes possible to alleviate stress and gradually improve one’s financial situation. The key is recognizing the weight of these fears and taking deliberate action to overcome them."
